=== TÃ¢ches PlanifiÃ©es ===
Date: 2024-03-15
Heure: 14:00

[FACTURES]
- Relance des factures en retard
- VÃ©rification des Ã©chÃ©ances

[NOTIFICATIONS]
- VÃ©rification des Ã©chÃ©ances Ã  venir
- DÃ©tection des retards de paiement
- CrÃ©ation des notifications

=== Log d'exÃ©cution ===
14/06/2025 15:26:32,03 - DÃ©marrage de la tÃ¢che 
DÃ©marrage de la relance des factures Ã  2025-06-14 13:26:33.132450+00:00
Relance des factures terminÃ©e avec succÃ¨s
14/06/2025 15:26:33,16 - Fin de la tÃ¢che 
 
15/06/2025 14:02:20,52 - DÃ©marrage de la tÃ¢che 
DÃ©marrage de la relance des factures Ã  2025-06-15 12:02:21.478342+00:00
Relance des factures terminÃ©e avec succÃ¨s
15/06/2025 14:02:21,52 - Fin de la tÃ¢che 
 
16/06/2025 14:05:45,25 - DÃ©marrage de la tÃ¢che 
Traceback (most recent call last):
  File "C:\Users\gojak\OneDrive\Bureau\mini-crm\manage_tasks.py", line 9, in <module>
    django.setup()
    ~~~~~~~~~~~~^^
  File "C:\Users\gojak\AppData\Local\Programs\Python\Python313\Lib\site-packages\django\__init__.py", line 19, in setup
    configure_logging(settings.LOGGING_CONFIG, settings.LOGGING)
                      ^^^^^^^^^^^^^^^^^^^^^^^
  File "C:\Users\gojak\AppData\Local\Programs\Python\Python313\Lib\site-packages\django\conf\__init__.py", line 81, in __getattr__
    self._setup(name)
    ~~~~~~~~~~~^^^^^^
  File "C:\Users\gojak\AppData\Local\Programs\Python\Python313\Lib\site-packages\django\conf\__init__.py", line 68, in _setup
    self._wrapped = Settings(settings_module)
                    ~~~~~~~~^^^^^^^^^^^^^^^^^
  File "C:\Users\gojak\AppData\Local\Programs\Python\Python313\Lib\site-packages\django\conf\__init__.py", line 166, in __init__
    mod = importlib.import_module(self.SETTINGS_MODULE)
  File "C:\Users\gojak\AppData\Local\Programs\Python\Python313\Lib\importlib\__init__.py", line 88, in import_module
    return _bootstrap._gcd_import(name[level:], package, level)
           ~~~~~~~~~~~~~~~~~~~~~~^^^^^^^^^^^^^^^^^^^^^^^^^^^^^^
  File "<frozen importlib._bootstrap>", line 1387, in _gcd_import
  File "<frozen importlib._bootstrap>", line 1360, in _find_and_load
  File "<frozen importlib._bootstrap>", line 1310, in _find_and_load_unlocked
  File "<frozen importlib._bootstrap>", line 488, in _call_with_frames_removed
  File "<frozen importlib._bootstrap>", line 1387, in _gcd_import
  File "<frozen importlib._bootstrap>", line 1360, in _find_and_load
  File "<frozen importlib._bootstrap>", line 1331, in _find_and_load_unlocked
  File "<frozen importlib._bootstrap>", line 935, in _load_unlocked
  File "<frozen importlib._bootstrap_external>", line 1022, in exec_module
  File "<frozen importlib._bootstrap>", line 488, in _call_with_frames_removed
  File "C:\Users\gojak\OneDrive\Bureau\mini-crm\mini_crm\__init__.py", line 2, in <module>
    from .celery import app as celery_app
  File "C:\Users\gojak\OneDrive\Bureau\mini-crm\mini_crm\celery.py", line 3, in <module>
    from celery import Celery
ModuleNotFoundError: No module named 'celery'
16/06/2025 14:05:45,93 - Fin de la tÃ¢che 
 
17/06/2025 15:50:08,19 - DÃ©marrage de la tÃ¢che 
Traceback (most recent call last):
  File "C:\Users\gojak\OneDrive\Bureau\mini-crm\manage_tasks.py", line 9, in <module>
    django.setup()
    ~~~~~~~~~~~~^^
  File "C:\Users\gojak\AppData\Local\Programs\Python\Python313\Lib\site-packages\django\__init__.py", line 19, in setup
    configure_logging(settings.LOGGING_CONFIG, settings.LOGGING)
                      ^^^^^^^^^^^^^^^^^^^^^^^
  File "C:\Users\gojak\AppData\Local\Programs\Python\Python313\Lib\site-packages\django\conf\__init__.py", line 81, in __getattr__
    self._setup(name)
    ~~~~~~~~~~~^^^^^^
  File "C:\Users\gojak\AppData\Local\Programs\Python\Python313\Lib\site-packages\django\conf\__init__.py", line 68, in _setup
    self._wrapped = Settings(settings_module)
                    ~~~~~~~~^^^^^^^^^^^^^^^^^
  File "C:\Users\gojak\AppData\Local\Programs\Python\Python313\Lib\site-packages\django\conf\__init__.py", line 166, in __init__
    mod = importlib.import_module(self.SETTINGS_MODULE)
  File "C:\Users\gojak\AppData\Local\Programs\Python\Python313\Lib\importlib\__init__.py", line 88, in import_module
    return _bootstrap._gcd_import(name[level:], package, level)
           ~~~~~~~~~~~~~~~~~~~~~~^^^^^^^^^^^^^^^^^^^^^^^^^^^^^^
  File "<frozen importlib._bootstrap>", line 1387, in _gcd_import
  File "<frozen importlib._bootstrap>", line 1360, in _find_and_load
  File "<frozen importlib._bootstrap>", line 1310, in _find_and_load_unlocked
  File "<frozen importlib._bootstrap>", line 488, in _call_with_frames_removed
  File "<frozen importlib._bootstrap>", line 1387, in _gcd_import
  File "<frozen importlib._bootstrap>", line 1360, in _find_and_load
  File "<frozen importlib._bootstrap>", line 1331, in _find_and_load_unlocked
  File "<frozen importlib._bootstrap>", line 935, in _load_unlocked
  File "<frozen importlib._bootstrap_external>", line 1022, in exec_module
  File "<frozen importlib._bootstrap>", line 488, in _call_with_frames_removed
  File "C:\Users\gojak\OneDrive\Bureau\mini-crm\mini_crm\__init__.py", line 2, in <module>
    from .celery import app as celery_app
  File "C:\Users\gojak\OneDrive\Bureau\mini-crm\mini_crm\celery.py", line 3, in <module>
    from celery import Celery
ModuleNotFoundError: No module named 'celery'
17/06/2025 15:50:08,94 - Fin de la tÃ¢che 
 
19/06/2025 14:46:13,70 - DÃ©marrage de la tÃ¢che 
Traceback (most recent call last):
  File "C:\Users\gojak\OneDrive\Bureau\mini-crm\manage_tasks.py", line 9, in <module>
    django.setup()
    ~~~~~~~~~~~~^^
  File "C:\Users\gojak\AppData\Local\Programs\Python\Python313\Lib\site-packages\django\__init__.py", line 19, in setup
    configure_logging(settings.LOGGING_CONFIG, settings.LOGGING)
                      ^^^^^^^^^^^^^^^^^^^^^^^
  File "C:\Users\gojak\AppData\Local\Programs\Python\Python313\Lib\site-packages\django\conf\__init__.py", line 81, in __getattr__
    self._setup(name)
    ~~~~~~~~~~~^^^^^^
  File "C:\Users\gojak\AppData\Local\Programs\Python\Python313\Lib\site-packages\django\conf\__init__.py", line 68, in _setup
    self._wrapped = Settings(settings_module)
                    ~~~~~~~~^^^^^^^^^^^^^^^^^
  File "C:\Users\gojak\AppData\Local\Programs\Python\Python313\Lib\site-packages\django\conf\__init__.py", line 166, in __init__
    mod = importlib.import_module(self.SETTINGS_MODULE)
  File "C:\Users\gojak\AppData\Local\Programs\Python\Python313\Lib\importlib\__init__.py", line 88, in import_module
    return _bootstrap._gcd_import(name[level:], package, level)
           ~~~~~~~~~~~~~~~~~~~~~~^^^^^^^^^^^^^^^^^^^^^^^^^^^^^^
  File "<frozen importlib._bootstrap>", line 1387, in _gcd_import
  File "<frozen importlib._bootstrap>", line 1360, in _find_and_load
  File "<frozen importlib._bootstrap>", line 1310, in _find_and_load_unlocked
  File "<frozen importlib._bootstrap>", line 488, in _call_with_frames_removed
  File "<frozen importlib._bootstrap>", line 1387, in _gcd_import
  File "<frozen importlib._bootstrap>", line 1360, in _find_and_load
  File "<frozen importlib._bootstrap>", line 1331, in _find_and_load_unlocked
  File "<frozen importlib._bootstrap>", line 935, in _load_unlocked
  File "<frozen importlib._bootstrap_external>", line 1022, in exec_module
  File "<frozen importlib._bootstrap>", line 488, in _call_with_frames_removed
  File "C:\Users\gojak\OneDrive\Bureau\mini-crm\mini_crm\__init__.py", line 2, in <module>
    from .celery import app as celery_app
  File "C:\Users\gojak\OneDrive\Bureau\mini-crm\mini_crm\celery.py", line 3, in <module>
    from celery import Celery
ModuleNotFoundError: No module named 'celery'
19/06/2025 14:46:14,38 - Fin de la tÃ¢che 
 
20/06/2025 22:46:24,71 - DÃ©marrage de la tÃ¢che 
Traceback (most recent call last):
  File "C:\Users\gojak\OneDrive\Bureau\mini-crm\manage_tasks.py", line 9, in <module>
    django.setup()
    ~~~~~~~~~~~~^^
  File "C:\Users\gojak\AppData\Local\Programs\Python\Python313\Lib\site-packages\django\__init__.py", line 19, in setup
    configure_logging(settings.LOGGING_CONFIG, settings.LOGGING)
                      ^^^^^^^^^^^^^^^^^^^^^^^
  File "C:\Users\gojak\AppData\Local\Programs\Python\Python313\Lib\site-packages\django\conf\__init__.py", line 81, in __getattr__
    self._setup(name)
    ~~~~~~~~~~~^^^^^^
  File "C:\Users\gojak\AppData\Local\Programs\Python\Python313\Lib\site-packages\django\conf\__init__.py", line 68, in _setup
    self._wrapped = Settings(settings_module)
                    ~~~~~~~~^^^^^^^^^^^^^^^^^
  File "C:\Users\gojak\AppData\Local\Programs\Python\Python313\Lib\site-packages\django\conf\__init__.py", line 166, in __init__
    mod = importlib.import_module(self.SETTINGS_MODULE)
  File "C:\Users\gojak\AppData\Local\Programs\Python\Python313\Lib\importlib\__init__.py", line 88, in import_module
    return _bootstrap._gcd_import(name[level:], package, level)
           ~~~~~~~~~~~~~~~~~~~~~~^^^^^^^^^^^^^^^^^^^^^^^^^^^^^^
  File "<frozen importlib._bootstrap>", line 1387, in _gcd_import
  File "<frozen importlib._bootstrap>", line 1360, in _find_and_load
  File "<frozen importlib._bootstrap>", line 1310, in _find_and_load_unlocked
  File "<frozen importlib._bootstrap>", line 488, in _call_with_frames_removed
  File "<frozen importlib._bootstrap>", line 1387, in _gcd_import
  File "<frozen importlib._bootstrap>", line 1360, in _find_and_load
  File "<frozen importlib._bootstrap>", line 1331, in _find_and_load_unlocked
  File "<frozen importlib._bootstrap>", line 935, in _load_unlocked
  File "<frozen importlib._bootstrap_external>", line 1022, in exec_module
  File "<frozen importlib._bootstrap>", line 488, in _call_with_frames_removed
  File "C:\Users\gojak\OneDrive\Bureau\mini-crm\mini_crm\__init__.py", line 2, in <module>
    from .celery import app as celery_app
  File "C:\Users\gojak\OneDrive\Bureau\mini-crm\mini_crm\celery.py", line 3, in <module>
    from celery import Celery
ModuleNotFoundError: No module named 'celery'
20/06/2025 22:46:26,05 - Fin de la tÃ¢che 
 
21/06/2025 18:44:29,21 - DÃ©marrage de la tÃ¢che 
Traceback (most recent call last):
  File "C:\Users\gojak\OneDrive\Bureau\mini-crm\manage_tasks.py", line 9, in <module>
    django.setup()
    ~~~~~~~~~~~~^^
  File "C:\Users\gojak\AppData\Local\Programs\Python\Python313\Lib\site-packages\django\__init__.py", line 19, in setup
    configure_logging(settings.LOGGING_CONFIG, settings.LOGGING)
                      ^^^^^^^^^^^^^^^^^^^^^^^
  File "C:\Users\gojak\AppData\Local\Programs\Python\Python313\Lib\site-packages\django\conf\__init__.py", line 81, in __getattr__
    self._setup(name)
    ~~~~~~~~~~~^^^^^^
  File "C:\Users\gojak\AppData\Local\Programs\Python\Python313\Lib\site-packages\django\conf\__init__.py", line 68, in _setup
    self._wrapped = Settings(settings_module)
                    ~~~~~~~~^^^^^^^^^^^^^^^^^
  File "C:\Users\gojak\AppData\Local\Programs\Python\Python313\Lib\site-packages\django\conf\__init__.py", line 166, in __init__
    mod = importlib.import_module(self.SETTINGS_MODULE)
  File "C:\Users\gojak\AppData\Local\Programs\Python\Python313\Lib\importlib\__init__.py", line 88, in import_module
    return _bootstrap._gcd_import(name[level:], package, level)
           ~~~~~~~~~~~~~~~~~~~~~~^^^^^^^^^^^^^^^^^^^^^^^^^^^^^^
  File "<frozen importlib._bootstrap>", line 1387, in _gcd_import
  File "<frozen importlib._bootstrap>", line 1360, in _find_and_load
  File "<frozen importlib._bootstrap>", line 1310, in _find_and_load_unlocked
  File "<frozen importlib._bootstrap>", line 488, in _call_with_frames_removed
  File "<frozen importlib._bootstrap>", line 1387, in _gcd_import
  File "<frozen importlib._bootstrap>", line 1360, in _find_and_load
  File "<frozen importlib._bootstrap>", line 1331, in _find_and_load_unlocked
  File "<frozen importlib._bootstrap>", line 935, in _load_unlocked
  File "<frozen importlib._bootstrap_external>", line 1022, in exec_module
  File "<frozen importlib._bootstrap>", line 488, in _call_with_frames_removed
  File "C:\Users\gojak\OneDrive\Bureau\mini-crm\mini_crm\__init__.py", line 2, in <module>
    from .celery import app as celery_app
  File "C:\Users\gojak\OneDrive\Bureau\mini-crm\mini_crm\celery.py", line 3, in <module>
    from celery import Celery
ModuleNotFoundError: No module named 'celery'
21/06/2025 18:44:30,08 - Fin de la tÃ¢che 
 
23/06/2025 22:24:27,97 - DÃ©marrage de la tÃ¢che 
Traceback (most recent call last):
  File "C:\Users\gojak\OneDrive\Bureau\mini-crm\manage_tasks.py", line 9, in <module>
    django.setup()
    ~~~~~~~~~~~~^^
  File "C:\Users\gojak\AppData\Local\Programs\Python\Python313\Lib\site-packages\django\__init__.py", line 19, in setup
    configure_logging(settings.LOGGING_CONFIG, settings.LOGGING)
                      ^^^^^^^^^^^^^^^^^^^^^^^
  File "C:\Users\gojak\AppData\Local\Programs\Python\Python313\Lib\site-packages\django\conf\__init__.py", line 81, in __getattr__
    self._setup(name)
    ~~~~~~~~~~~^^^^^^
  File "C:\Users\gojak\AppData\Local\Programs\Python\Python313\Lib\site-packages\django\conf\__init__.py", line 68, in _setup
    self._wrapped = Settings(settings_module)
                    ~~~~~~~~^^^^^^^^^^^^^^^^^
  File "C:\Users\gojak\AppData\Local\Programs\Python\Python313\Lib\site-packages\django\conf\__init__.py", line 166, in __init__
    mod = importlib.import_module(self.SETTINGS_MODULE)
  File "C:\Users\gojak\AppData\Local\Programs\Python\Python313\Lib\importlib\__init__.py", line 88, in import_module
    return _bootstrap._gcd_import(name[level:], package, level)
           ~~~~~~~~~~~~~~~~~~~~~~^^^^^^^^^^^^^^^^^^^^^^^^^^^^^^
  File "<frozen importlib._bootstrap>", line 1387, in _gcd_import
  File "<frozen importlib._bootstrap>", line 1360, in _find_and_load
  File "<frozen importlib._bootstrap>", line 1310, in _find_and_load_unlocked
  File "<frozen importlib._bootstrap>", line 488, in _call_with_frames_removed
  File "<frozen importlib._bootstrap>", line 1387, in _gcd_import
  File "<frozen importlib._bootstrap>", line 1360, in _find_and_load
  File "<frozen importlib._bootstrap>", line 1331, in _find_and_load_unlocked
  File "<frozen importlib._bootstrap>", line 935, in _load_unlocked
  File "<frozen importlib._bootstrap_external>", line 1022, in exec_module
  File "<frozen importlib._bootstrap>", line 488, in _call_with_frames_removed
  File "C:\Users\gojak\OneDrive\Bureau\mini-crm\mini_crm\__init__.py", line 2, in <module>
    from .celery import app as celery_app
  File "C:\Users\gojak\OneDrive\Bureau\mini-crm\mini_crm\celery.py", line 3, in <module>
    from celery import Celery
ModuleNotFoundError: No module named 'celery'
23/06/2025 22:24:28,96 - Fin de la tÃ¢che 
 
24/06/2025 14:48:51,87 - DÃ©marrage de la tÃ¢che 
Traceback (most recent call last):
  File "C:\Users\gojak\OneDrive\Bureau\mini-crm\manage_tasks.py", line 9, in <module>
    django.setup()
    ~~~~~~~~~~~~^^
  File "C:\Users\gojak\AppData\Local\Programs\Python\Python313\Lib\site-packages\django\__init__.py", line 19, in setup
    configure_logging(settings.LOGGING_CONFIG, settings.LOGGING)
                      ^^^^^^^^^^^^^^^^^^^^^^^
  File "C:\Users\gojak\AppData\Local\Programs\Python\Python313\Lib\site-packages\django\conf\__init__.py", line 81, in __getattr__
    self._setup(name)
    ~~~~~~~~~~~^^^^^^
  File "C:\Users\gojak\AppData\Local\Programs\Python\Python313\Lib\site-packages\django\conf\__init__.py", line 68, in _setup
    self._wrapped = Settings(settings_module)
                    ~~~~~~~~^^^^^^^^^^^^^^^^^
  File "C:\Users\gojak\AppData\Local\Programs\Python\Python313\Lib\site-packages\django\conf\__init__.py", line 166, in __init__
    mod = importlib.import_module(self.SETTINGS_MODULE)
  File "C:\Users\gojak\AppData\Local\Programs\Python\Python313\Lib\importlib\__init__.py", line 88, in import_module
    return _bootstrap._gcd_import(name[level:], package, level)
           ~~~~~~~~~~~~~~~~~~~~~~^^^^^^^^^^^^^^^^^^^^^^^^^^^^^^
  File "<frozen importlib._bootstrap>", line 1387, in _gcd_import
  File "<frozen importlib._bootstrap>", line 1360, in _find_and_load
  File "<frozen importlib._bootstrap>", line 1310, in _find_and_load_unlocked
  File "<frozen importlib._bootstrap>", line 488, in _call_with_frames_removed
  File "<frozen importlib._bootstrap>", line 1387, in _gcd_import
  File "<frozen importlib._bootstrap>", line 1360, in _find_and_load
  File "<frozen importlib._bootstrap>", line 1331, in _find_and_load_unlocked
  File "<frozen importlib._bootstrap>", line 935, in _load_unlocked
  File "<frozen importlib._bootstrap_external>", line 1022, in exec_module
  File "<frozen importlib._bootstrap>", line 488, in _call_with_frames_removed
  File "C:\Users\gojak\OneDrive\Bureau\mini-crm\mini_crm\__init__.py", line 2, in <module>
    from .celery import app as celery_app
  File "C:\Users\gojak\OneDrive\Bureau\mini-crm\mini_crm\celery.py", line 3, in <module>
    from celery import Celery
ModuleNotFoundError: No module named 'celery'
24/06/2025 14:48:52,62 - Fin de la tÃ¢che 
 
25/06/2025 23:12:48,81 - DÃ©marrage de la tÃ¢che 
Traceback (most recent call last):
  File "C:\Users\gojak\OneDrive\Bureau\mini-crm\manage_tasks.py", line 9, in <module>
    django.setup()
    ~~~~~~~~~~~~^^
  File "C:\Users\gojak\AppData\Local\Programs\Python\Python313\Lib\site-packages\django\__init__.py", line 19, in setup
    configure_logging(settings.LOGGING_CONFIG, settings.LOGGING)
                      ^^^^^^^^^^^^^^^^^^^^^^^
  File "C:\Users\gojak\AppData\Local\Programs\Python\Python313\Lib\site-packages\django\conf\__init__.py", line 81, in __getattr__
    self._setup(name)
    ~~~~~~~~~~~^^^^^^
  File "C:\Users\gojak\AppData\Local\Programs\Python\Python313\Lib\site-packages\django\conf\__init__.py", line 68, in _setup
    self._wrapped = Settings(settings_module)
                    ~~~~~~~~^^^^^^^^^^^^^^^^^
  File "C:\Users\gojak\AppData\Local\Programs\Python\Python313\Lib\site-packages\django\conf\__init__.py", line 166, in __init__
    mod = importlib.import_module(self.SETTINGS_MODULE)
  File "C:\Users\gojak\AppData\Local\Programs\Python\Python313\Lib\importlib\__init__.py", line 88, in import_module
    return _bootstrap._gcd_import(name[level:], package, level)
           ~~~~~~~~~~~~~~~~~~~~~~^^^^^^^^^^^^^^^^^^^^^^^^^^^^^^
  File "<frozen importlib._bootstrap>", line 1387, in _gcd_import
  File "<frozen importlib._bootstrap>", line 1360, in _find_and_load
  File "<frozen importlib._bootstrap>", line 1310, in _find_and_load_unlocked
  File "<frozen importlib._bootstrap>", line 488, in _call_with_frames_removed
  File "<frozen importlib._bootstrap>", line 1387, in _gcd_import
  File "<frozen importlib._bootstrap>", line 1360, in _find_and_load
  File "<frozen importlib._bootstrap>", line 1331, in _find_and_load_unlocked
  File "<frozen importlib._bootstrap>", line 935, in _load_unlocked
  File "<frozen importlib._bootstrap_external>", line 1022, in exec_module
  File "<frozen importlib._bootstrap>", line 488, in _call_with_frames_removed
  File "C:\Users\gojak\OneDrive\Bureau\mini-crm\mini_crm\__init__.py", line 2, in <module>
    from .celery import app as celery_app
  File "C:\Users\gojak\OneDrive\Bureau\mini-crm\mini_crm\celery.py", line 3, in <module>
    from celery import Celery
ModuleNotFoundError: No module named 'celery'
25/06/2025 23:12:49,63 - Fin de la tÃ¢che 
 
27/06/2025  0:06:33,01 - DÃ©marrage de la tÃ¢che 
Traceback (most recent call last):
  File "C:\Users\gojak\OneDrive\Bureau\mini-crm\manage_tasks.py", line 9, in <module>
    django.setup()
    ~~~~~~~~~~~~^^
  File "C:\Users\gojak\AppData\Local\Programs\Python\Python313\Lib\site-packages\django\__init__.py", line 19, in setup
    configure_logging(settings.LOGGING_CONFIG, settings.LOGGING)
                      ^^^^^^^^^^^^^^^^^^^^^^^
  File "C:\Users\gojak\AppData\Local\Programs\Python\Python313\Lib\site-packages\django\conf\__init__.py", line 81, in __getattr__
    self._setup(name)
    ~~~~~~~~~~~^^^^^^
  File "C:\Users\gojak\AppData\Local\Programs\Python\Python313\Lib\site-packages\django\conf\__init__.py", line 68, in _setup
    self._wrapped = Settings(settings_module)
                    ~~~~~~~~^^^^^^^^^^^^^^^^^
  File "C:\Users\gojak\AppData\Local\Programs\Python\Python313\Lib\site-packages\django\conf\__init__.py", line 166, in __init__
    mod = importlib.import_module(self.SETTINGS_MODULE)
  File "C:\Users\gojak\AppData\Local\Programs\Python\Python313\Lib\importlib\__init__.py", line 88, in import_module
    return _bootstrap._gcd_import(name[level:], package, level)
           ~~~~~~~~~~~~~~~~~~~~~~^^^^^^^^^^^^^^^^^^^^^^^^^^^^^^
  File "<frozen importlib._bootstrap>", line 1387, in _gcd_import
  File "<frozen importlib._bootstrap>", line 1360, in _find_and_load
  File "<frozen importlib._bootstrap>", line 1310, in _find_and_load_unlocked
  File "<frozen importlib._bootstrap>", line 488, in _call_with_frames_removed
  File "<frozen importlib._bootstrap>", line 1387, in _gcd_import
  File "<frozen importlib._bootstrap>", line 1360, in _find_and_load
  File "<frozen importlib._bootstrap>", line 1331, in _find_and_load_unlocked
  File "<frozen importlib._bootstrap>", line 935, in _load_unlocked
  File "<frozen importlib._bootstrap_external>", line 1022, in exec_module
  File "<frozen importlib._bootstrap>", line 488, in _call_with_frames_removed
  File "C:\Users\gojak\OneDrive\Bureau\mini-crm\mini_crm\__init__.py", line 2, in <module>
    from .celery import app as celery_app
  File "C:\Users\gojak\OneDrive\Bureau\mini-crm\mini_crm\celery.py", line 3, in <module>
    from celery import Celery
ModuleNotFoundError: No module named 'celery'
27/06/2025  0:06:33,54 - Fin de la tÃ¢che 
 
27/06/2025 23:44:25,15 - DÃ©marrage de la tÃ¢che 
Traceback (most recent call last):
  File "C:\Users\gojak\OneDrive\Bureau\mini-crm\manage_tasks.py", line 9, in <module>
    django.setup()
    ~~~~~~~~~~~~^^
  File "C:\Users\gojak\AppData\Local\Programs\Python\Python313\Lib\site-packages\django\__init__.py", line 19, in setup
    configure_logging(settings.LOGGING_CONFIG, settings.LOGGING)
                      ^^^^^^^^^^^^^^^^^^^^^^^
  File "C:\Users\gojak\AppData\Local\Programs\Python\Python313\Lib\site-packages\django\conf\__init__.py", line 81, in __getattr__
    self._setup(name)
    ~~~~~~~~~~~^^^^^^
  File "C:\Users\gojak\AppData\Local\Programs\Python\Python313\Lib\site-packages\django\conf\__init__.py", line 68, in _setup
    self._wrapped = Settings(settings_module)
                    ~~~~~~~~^^^^^^^^^^^^^^^^^
  File "C:\Users\gojak\AppData\Local\Programs\Python\Python313\Lib\site-packages\django\conf\__init__.py", line 166, in __init__
    mod = importlib.import_module(self.SETTINGS_MODULE)
  File "C:\Users\gojak\AppData\Local\Programs\Python\Python313\Lib\importlib\__init__.py", line 88, in import_module
    return _bootstrap._gcd_import(name[level:], package, level)
           ~~~~~~~~~~~~~~~~~~~~~~^^^^^^^^^^^^^^^^^^^^^^^^^^^^^^
  File "<frozen importlib._bootstrap>", line 1387, in _gcd_import
  File "<frozen importlib._bootstrap>", line 1360, in _find_and_load
  File "<frozen importlib._bootstrap>", line 1310, in _find_and_load_unlocked
  File "<frozen importlib._bootstrap>", line 488, in _call_with_frames_removed
  File "<frozen importlib._bootstrap>", line 1387, in _gcd_import
  File "<frozen importlib._bootstrap>", line 1360, in _find_and_load
  File "<frozen importlib._bootstrap>", line 1331, in _find_and_load_unlocked
  File "<frozen importlib._bootstrap>", line 935, in _load_unlocked
  File "<frozen importlib._bootstrap_external>", line 1022, in exec_module
  File "<frozen importlib._bootstrap>", line 488, in _call_with_frames_removed
  File "C:\Users\gojak\OneDrive\Bureau\mini-crm\mini_crm\__init__.py", line 2, in <module>
    from .celery import app as celery_app
  File "C:\Users\gojak\OneDrive\Bureau\mini-crm\mini_crm\celery.py", line 3, in <module>
    from celery import Celery
ModuleNotFoundError: No module named 'celery'
27/06/2025 23:44:25,99 - Fin de la tÃ¢che 
 
28/06/2025 16:32:36,31 - DÃ©marrage de la tÃ¢che 
Traceback (most recent call last):
  File "C:\Users\gojak\OneDrive\Bureau\mini-crm\manage_tasks.py", line 9, in <module>
    django.setup()
    ~~~~~~~~~~~~^^
  File "C:\Users\gojak\AppData\Local\Programs\Python\Python313\Lib\site-packages\django\__init__.py", line 19, in setup
    configure_logging(settings.LOGGING_CONFIG, settings.LOGGING)
                      ^^^^^^^^^^^^^^^^^^^^^^^
  File "C:\Users\gojak\AppData\Local\Programs\Python\Python313\Lib\site-packages\django\conf\__init__.py", line 81, in __getattr__
    self._setup(name)
    ~~~~~~~~~~~^^^^^^
  File "C:\Users\gojak\AppData\Local\Programs\Python\Python313\Lib\site-packages\django\conf\__init__.py", line 68, in _setup
    self._wrapped = Settings(settings_module)
                    ~~~~~~~~^^^^^^^^^^^^^^^^^
  File "C:\Users\gojak\AppData\Local\Programs\Python\Python313\Lib\site-packages\django\conf\__init__.py", line 166, in __init__
    mod = importlib.import_module(self.SETTINGS_MODULE)
  File "C:\Users\gojak\AppData\Local\Programs\Python\Python313\Lib\importlib\__init__.py", line 88, in import_module
    return _bootstrap._gcd_import(name[level:], package, level)
           ~~~~~~~~~~~~~~~~~~~~~~^^^^^^^^^^^^^^^^^^^^^^^^^^^^^^
  File "<frozen importlib._bootstrap>", line 1387, in _gcd_import
  File "<frozen importlib._bootstrap>", line 1360, in _find_and_load
  File "<frozen importlib._bootstrap>", line 1310, in _find_and_load_unlocked
  File "<frozen importlib._bootstrap>", line 488, in _call_with_frames_removed
  File "<frozen importlib._bootstrap>", line 1387, in _gcd_import
  File "<frozen importlib._bootstrap>", line 1360, in _find_and_load
  File "<frozen importlib._bootstrap>", line 1331, in _find_and_load_unlocked
  File "<frozen importlib._bootstrap>", line 935, in _load_unlocked
  File "<frozen importlib._bootstrap_external>", line 1022, in exec_module
  File "<frozen importlib._bootstrap>", line 488, in _call_with_frames_removed
  File "C:\Users\gojak\OneDrive\Bureau\mini-crm\mini_crm\__init__.py", line 2, in <module>
    from .celery import app as celery_app
  File "C:\Users\gojak\OneDrive\Bureau\mini-crm\mini_crm\celery.py", line 3, in <module>
    from celery import Celery
ModuleNotFoundError: No module named 'celery'
28/06/2025 16:32:37,45 - Fin de la tÃ¢che 
 
29/06/2025 14:00:12,68 - DÃ©marrage de la tÃ¢che 
Traceback (most recent call last):
  File "C:\Users\gojak\OneDrive\Bureau\mini-crm\manage_tasks.py", line 9, in <module>
    django.setup()
    ~~~~~~~~~~~~^^
  File "C:\Users\gojak\AppData\Local\Programs\Python\Python313\Lib\site-packages\django\__init__.py", line 19, in setup
    configure_logging(settings.LOGGING_CONFIG, settings.LOGGING)
                      ^^^^^^^^^^^^^^^^^^^^^^^
  File "C:\Users\gojak\AppData\Local\Programs\Python\Python313\Lib\site-packages\django\conf\__init__.py", line 81, in __getattr__
    self._setup(name)
    ~~~~~~~~~~~^^^^^^
  File "C:\Users\gojak\AppData\Local\Programs\Python\Python313\Lib\site-packages\django\conf\__init__.py", line 68, in _setup
    self._wrapped = Settings(settings_module)
                    ~~~~~~~~^^^^^^^^^^^^^^^^^
  File "C:\Users\gojak\AppData\Local\Programs\Python\Python313\Lib\site-packages\django\conf\__init__.py", line 166, in __init__
    mod = importlib.import_module(self.SETTINGS_MODULE)
  File "C:\Users\gojak\AppData\Local\Programs\Python\Python313\Lib\importlib\__init__.py", line 88, in import_module
    return _bootstrap._gcd_import(name[level:], package, level)
           ~~~~~~~~~~~~~~~~~~~~~~^^^^^^^^^^^^^^^^^^^^^^^^^^^^^^
  File "<frozen importlib._bootstrap>", line 1387, in _gcd_import
  File "<frozen importlib._bootstrap>", line 1360, in _find_and_load
  File "<frozen importlib._bootstrap>", line 1310, in _find_and_load_unlocked
  File "<frozen importlib._bootstrap>", line 488, in _call_with_frames_removed
  File "<frozen importlib._bootstrap>", line 1387, in _gcd_import
  File "<frozen importlib._bootstrap>", line 1360, in _find_and_load
  File "<frozen importlib._bootstrap>", line 1331, in _find_and_load_unlocked
  File "<frozen importlib._bootstrap>", line 935, in _load_unlocked
  File "<frozen importlib._bootstrap_external>", line 1022, in exec_module
  File "<frozen importlib._bootstrap>", line 488, in _call_with_frames_removed
  File "C:\Users\gojak\OneDrive\Bureau\mini-crm\mini_crm\__init__.py", line 2, in <module>
    from .celery import app as celery_app
  File "C:\Users\gojak\OneDrive\Bureau\mini-crm\mini_crm\celery.py", line 3, in <module>
    from celery import Celery
ModuleNotFoundError: No module named 'celery'
29/06/2025 14:00:13,15 - Fin de la tÃ¢che 
 
01/07/2025 22:15:07,98 - DÃ©marrage de la tÃ¢che 
Démarrage des tâches à 2025-07-01 20:15:09.632888+00:00
Démarrage de la relance des factures...
Relance des factures terminée avec succès
Démarrage de la vérification des notifications...
Vérification des notifications terminée avec succès
01/07/2025 22:15:09,69 - Fin de la tÃ¢che 
 
02/07/2025 12:13:27,15 - DÃ©marrage de la tÃ¢che 
Démarrage des tâches à 2025-07-02 10:13:28.399439+00:00
Démarrage de la relance des factures...
Relance des factures terminée avec succès
Démarrage de la vérification des notifications...
Vérification des notifications terminée avec succès
02/07/2025 12:13:28,45 - Fin de la tÃ¢che 
 
04/07/2025 14:32:56,09 - DÃ©marrage de la tÃ¢che 
Démarrage des tâches à 2025-07-04 12:32:57.381536+00:00
Démarrage de la relance des factures...
Relance des factures terminée avec succès
Démarrage de la vérification des notifications...
Vérification des notifications terminée avec succès
04/07/2025 14:32:57,43 - Fin de la tÃ¢che 
 
05/07/2025 22:26:48,70 - DÃ©marrage de la tÃ¢che 
Démarrage des tâches à 2025-07-05 20:26:49.643266+00:00
Démarrage de la relance des factures...
Relance des factures terminée avec succès
Démarrage de la vérification des notifications...
Vérification des notifications terminée avec succès
05/07/2025 22:26:49,70 - Fin de la tÃ¢che 
 
06/07/2025 14:24:12,98 - DÃ©marrage de la tÃ¢che 
07/07/2025 16:04:20,66 - DÃ©marrage de la tÃ¢che 
Démarrage des tâches à 2025-07-07 14:04:22.034336+00:00
Démarrage de la relance des factures...
Relance des factures terminée avec succès
Démarrage de la vérification des notifications...
Vérification des notifications terminée avec succès
07/07/2025 16:04:22,09 - Fin de la tÃ¢che 
 
09/07/2025  1:42:01,60 - DÃ©marrage de la tÃ¢che 
Démarrage des tâches à 2025-07-08 23:42:02.834637+00:00
Démarrage de la relance des factures...
Relance des factures terminée avec succès
Démarrage de la vérification des notifications...
Vérification des notifications terminée avec succès
09/07/2025  1:42:02,89 - Fin de la tÃ¢che 
 
10/07/2025  0:13:53,37 - DÃ©marrage de la tÃ¢che 
Démarrage des tâches à 2025-07-09 22:13:55.718124+00:00
Démarrage de la relance des factures...
Relance des factures terminée avec succès
Démarrage de la vérification des notifications...
Vérification des notifications terminée avec succès
10/07/2025  0:13:55,79 - Fin de la tÃ¢che 
 
10/07/2025 23:43:15,53 - DÃ©marrage de la tÃ¢che 
Démarrage des tâches à 2025-07-10 21:43:16.908372+00:00
Démarrage de la relance des factures...
Relance des factures terminée avec succès
Démarrage de la vérification des notifications...
Vérification des notifications terminée avec succès
10/07/2025 23:43:16,94 - Fin de la tÃ¢che 
 
12/07/2025  1:54:10,89 - DÃ©marrage de la tÃ¢che 
Démarrage des tâches à 2025-07-11 23:54:12.547161+00:00
Démarrage de la relance des factures...
Relance des factures terminée avec succès
Démarrage de la vérification des notifications...
Vérification des notifications terminée avec succès
12/07/2025  1:54:12,62 - Fin de la tÃ¢che 
 
12/07/2025 13:10:45,70 - DÃ©marrage de la tÃ¢che 
Démarrage des tâches à 2025-07-12 11:10:46.871839+00:00
Démarrage de la relance des factures...
Relance des factures terminée avec succès
Démarrage de la vérification des notifications...
Vérification des notifications terminée avec succès
12/07/2025 13:10:46,93 - Fin de la tÃ¢che 
 
15/07/2025  2:31:16,25 - DÃ©marrage de la tÃ¢che 
^C16/07/2025  0:44:36,53 - DÃ©marrage de la tÃ¢che 
Démarrage des tâches à 2025-07-15 22:44:37.750832+00:00
Démarrage de la relance des factures...
Relance des factures terminée avec succès
Démarrage de la vérification des notifications...
Vérification des notifications terminée avec succès
16/07/2025  0:44:37,81 - Fin de la tÃ¢che 
 
17/07/2025  2:07:12,40 - DÃ©marrage de la tÃ¢che 
Démarrage des tâches à 2025-07-17 00:07:14.504430+00:00
Démarrage de la relance des factures...
Relance des factures terminée avec succès
Démarrage de la vérification des notifications...
Vérification des notifications terminée avec succès
17/07/2025  2:07:14,57 - Fin de la tÃ¢che 
 
19/07/2025  0:35:51,26 - DÃ©marrage de la tÃ¢che 
Démarrage des tâches à 2025-07-18 22:35:52.721846+00:00
Démarrage de la relance des factures...
Relance des factures terminée avec succès
Démarrage de la vérification des notifications...
Vérification des notifications terminée avec succès
19/07/2025  0:35:52,76 - Fin de la tÃ¢che 
 
19/07/2025 22:57:58,31 - DÃ©marrage de la tÃ¢che 
Démarrage des tâches à 2025-07-19 20:57:59.588238+00:00
Démarrage de la relance des factures...
Relance des factures terminée avec succès
Démarrage de la vérification des notifications...
Vérification des notifications terminée avec succès
19/07/2025 22:57:59,64 - Fin de la tÃ¢che 
 
21/07/2025  2:26:10,60 - DÃ©marrage de la tÃ¢che 
Démarrage des tâches à 2025-07-21 00:26:12.156017+00:00
Démarrage de la relance des factures...
Relance des factures terminée avec succès
Démarrage de la vérification des notifications...
Vérification des notifications terminée avec succès
21/07/2025  2:26:12,22 - Fin de la tÃ¢che 
 
21/07/2025 23:34:54,21 - DÃ©marrage de la tÃ¢che 
Démarrage des tâches à 2025-07-21 21:34:55.340520+00:00
Démarrage de la relance des factures...
Relance des factures terminée avec succès
Démarrage de la vérification des notifications...
Vérification des notifications terminée avec succès
21/07/2025 23:34:55,38 - Fin de la tÃ¢che 
 
22/07/2025 15:42:11,56 - DÃ©marrage de la tÃ¢che 
Démarrage des tâches à 2025-07-22 13:42:14.264817+00:00
Démarrage de la relance des factures...
Relance des factures terminée avec succès
Démarrage de la vérification des notifications...
Vérification des notifications terminée avec succès
22/07/2025 15:42:14,35 - Fin de la tÃ¢che 
 
24/07/2025  0:18:43,23 - DÃ©marrage de la tÃ¢che 
Démarrage des tâches à 2025-07-23 22:18:46.248474+00:00
Démarrage de la relance des factures...
Relance des factures terminée avec succès
Démarrage de la vérification des notifications...
Vérification des notifications terminée avec succès
24/07/2025  0:18:46,30 - Fin de la tÃ¢che 
 
25/07/2025  1:08:24,70 - DÃ©marrage de la tÃ¢che 
Démarrage des tâches à 2025-07-24 23:08:25.965478+00:00
Démarrage de la relance des factures...
Relance des factures terminée avec succès
Démarrage de la vérification des notifications...
Vérification des notifications terminée avec succès
25/07/2025  1:08:26,03 - Fin de la tÃ¢che 
 
25/07/2025 17:46:06,74 - DÃ©marrage de la tÃ¢che 
Démarrage des tâches à 2025-07-25 15:46:08.879286+00:00
Démarrage de la relance des factures...
Relance des factures terminée avec succès
Démarrage de la vérification des notifications...
Vérification des notifications terminée avec succès
25/07/2025 17:46:08,95 - Fin de la tÃ¢che 
 
27/07/2025  0:37:16,41 - DÃ©marrage de la tÃ¢che 
Démarrage des tâches à 2025-07-26 22:37:17.873942+00:00
Démarrage de la relance des factures...
Relance des factures terminée avec succès
Démarrage de la vérification des notifications...
Vérification des notifications terminée avec succès
27/07/2025  0:37:17,93 - Fin de la tÃ¢che 
 
28/07/2025  0:26:15,06 - DÃ©marrage de la tÃ¢che 
Démarrage des tâches à 2025-07-27 22:26:16.641395+00:00
Démarrage de la relance des factures...
Relance des factures terminée avec succès
Démarrage de la vérification des notifications...
Vérification des notifications terminée avec succès
28/07/2025  0:26:16,80 - Fin de la tÃ¢che 
 
30/07/2025 21:52:05,13 - DÃ©marrage de la tÃ¢che 
Démarrage des tâches à 2025-07-30 19:52:07.457602+00:00
Démarrage de la relance des factures...
Relance des factures terminée avec succès
Démarrage de la vérification des notifications...
Vérification des notifications terminée avec succès
30/07/2025 21:52:07,51 - Fin de la tÃ¢che 
 
31/07/2025 19:31:08,44 - DÃ©marrage de la tÃ¢che 
Démarrage des tâches à 2025-07-31 17:31:09.660438+00:00
Démarrage de la relance des factures...
Relance des factures terminée avec succès
Démarrage de la vérification des notifications...
Vérification des notifications terminée avec succès
31/07/2025 19:31:09,71 - Fin de la tÃ¢che 
 
01/08/2025 16:29:31,66 - DÃ©marrage de la tÃ¢che 
Démarrage des tâches à 2025-08-01 14:29:32.891670+00:00
Démarrage de la relance des factures...
Relance des factures terminée avec succès
Démarrage de la vérification des notifications...
Vérification des notifications terminée avec succès
01/08/2025 16:29:32,94 - Fin de la tÃ¢che 
 
02/08/2025 15:11:32,56 - DÃ©marrage de la tÃ¢che 
Démarrage des tâches à 2025-08-02 13:11:34.214378+00:00
Démarrage de la relance des factures...
Relance des factures terminée avec succès
Démarrage de la vérification des notifications...
Vérification des notifications terminée avec succès
02/08/2025 15:11:34,25 - Fin de la tÃ¢che 
 
04/08/2025 22:46:55,39 - DÃ©marrage de la tÃ¢che 
Démarrage des tâches à 2025-08-04 20:46:57.217801+00:00
Démarrage de la relance des factures...
Relance des factures terminée avec succès
Démarrage de la vérification des notifications...
Vérification des notifications terminée avec succès
04/08/2025 22:46:57,27 - Fin de la tÃ¢che 
 
05/08/2025 22:30:10,42 - DÃ©marrage de la tÃ¢che 
Démarrage des tâches à 2025-08-05 20:30:12.719962+00:00
Démarrage de la relance des factures...
Relance des factures terminée avec succès
Démarrage de la vérification des notifications...
Vérification des notifications terminée avec succès
05/08/2025 22:30:12,77 - Fin de la tÃ¢che 
 
08/08/2025  1:32:03,85 - DÃ©marrage de la tÃ¢che 
Démarrage des tâches à 2025-08-07 23:32:08.476240+00:00
Démarrage de la relance des factures...
Relance des factures terminée avec succès
Démarrage de la vérification des notifications...
Vérification des notifications terminée avec succès
08/08/2025  1:32:08,65 - Fin de la tÃ¢che 
 
